{"$schema":"https://json-schema.org/draft/2020-12/schema","additionalProperties":false,"properties":{"activeProgramId":{"minLength":1,"type":"string"},"activeWaveId":{"anyOf":[{"minLength":1,"type":"string"},{"type":"null"}]},"blockedReasonCodes":{"items":{"minLength":1,"type":"string"},"type":"array"},"contractKind":{"const":"continuity-state","type":"string"},"lastEventHash":{"pattern":"^sha256:[a-f0-9]{64}$","type":"string"},"nextEligibleTaskIds":{"items":{"minLength":1,"type":"string"},"type":"array"},"projectStatus":{"enum":["experimental","candidate","verified","production"],"type":"string"},"revision":{"maximum":9007199254740991,"minimum":0,"type":"integer"},"schemaVersion":{"const":2,"type":"number"},"updatedAt":{"format":"date-time","pattern":"^(?:(?:\\d\\d[2468][048]|\\d\\d[13579][26]|\\d\\d0[48]|[02468][048]00|[13579][26]00)-02-29|\\d{4}-(?:(?:0[13578]|1[02])-(?:0[1-9]|[12]\\d|3[01])|(?:0[469]|11)-(?:0[1-9]|[12]\\d|30)|(?:02)-(?:0[1-9]|1\\d|2[0-8])))T(?:(?:[01]\\d|2[0-3]):[0-5]\\d(?::[0-5]\\d(?:\\.\\d+)?)?(?:Z|([+-](?:[01]\\d|2[0-3]):[0-5]\\d)))$","type":"string"}},"required":["schemaVersion","contractKind","revision","projectStatus","activeProgramId","activeWaveId","lastEventHash","updatedAt","nextEligibleTaskIds","blockedReasonCodes"],"type":"object"}