{"activeProgramId":"A","activeWaveId":null,"blockedReasonCodes":["VERIFIER_EVIDENCE_REQUIRED"],"contractKind":"continuity-state","lastEventHash":"sha256:879d440341a453c66db3319ffb06397732ebe6664e2701785b0e29615ed2c435","nextEligibleTaskIds":[],"projectStatus":"experimental","revision":0,"schemaVersion":2,"updatedAt":"2026-09-26T16:41:10.376Z"}